{
  "$schema": "../resource.schema.json",
  "id": "courses",
  "status": "published",
  "links": [
    {
      "label": "電機系完整修課規定",
      "description": "必修課表、修業細則、雙主修與輔系辦法",
      "href": "https://dee.nycu.edu.tw/pages.php?locale=tw&pa=stu_college_elective"
    },
    {
      "label": "教務處學期選課",
      "description": "選課說明、課程查詢與常見問題",
      "href": "https://www.nycu.edu.tw/aa/ch/app/artwebsite/view?id=4487&module=artwebsite&serno=c836c23c-8452-4cc5-b7c9-df07f4a18537"
    },
    {
      "label": "課程時間表",
      "description": "依學期、系所及課程條件查詢開課資訊",
      "href": "https://timetable.nycu.edu.tw/"
    }
  ],
  "sections": [
    {
      "id": "preparation",
      "type": "process",
      "title": "每學期選課流程",
      "items": [
        {
          "title": "盤點進度",
          "description": "比對必修科目表與已取得學分，列出本學期優先課程。"
        },
        {
          "title": "安排方向",
          "description": "依興趣選擇特色領域課程，同時檢查先修條件與課程衝堂。"
        },
        {
          "title": "查詢開課",
          "description": "在課程時間表確認課號、教室、容量與授課教師。"
        },
        {
          "title": "完成選課",
          "description": "由單一入口進入選課系統，並在加退選後再次核對結果。"
        }
      ]
    },
    {
      "id": "checklist",
      "type": "checklist",
      "title": "選課前檢查",
      "items": [
        "確認入學年度與組別",
        "查看必修及專業實驗完成狀態",
        "確認先修與擋修條件",
        "預留通識、外語與校共同課程",
        "需要時諮詢導師或系辦"
      ]
    }
  ]
}
